{
  "$schema": "http://json-schema.org/draft-04/schema#",
  "description": "",
  "type": "object",
  "properties": {
    "region": {
      "type": "string",
      "minLength": 1
    },
    "observed": {
      "type": "array",
      "uniqueItems": true,
      "minItems": 1,
      "items": {
        "required": [
          "week"
        ],
        "properties": {
          "week": {
            "type": "number"
          },
          "data": {
            "type": "array",
            "uniqueItems": true,
            "minItems": 1,
            "items": {
              "required": [
                "lag",
                "value"
              ],
              "properties": {
                "lag": {
                  "type": "number"
                },
                "value": {
                  "type": "number"
                }
              }
            }
          }
        }
      }
    },
    "actual": {
      "type": "array",
      "uniqueItems": true,
      "minItems": 1,
      "items": {
        "required": [
          "week",
          "data"
        ],
        "properties": {
          "week": {
            "type": "number"
          },
          "data": {
            "type": "number"
          }
        }
      }
    },
    "baseline": {
      "type": "number"
    },
    "models": {
      "type": "array",
      "uniqueItems": true,
      "minItems": 1,
      "items": {
        "required": [
          "id"
        ],
        "properties": {
          "id": {
            "type": "string",
            "minLength": 1
          },
          "meta": {
            "type": "object",
            "properties": {
              "name": {
                "type": "string",
                "minLength": 1
              },
              "description": {
                "type": "string",
                "minLength": 1
              },
              "url": {
                "type": "string",
                "minLength": 1
              }
            },
            "required": [
              "name",
              "description",
              "url"
            ]
          },
          "predictions": {
            "type": "array",
            "uniqueItems": true,
            "minItems": 1,
            "items": {
              "required": [
                "week"
              ],
              "properties": {
                "onsetWeek": {
                  "type": "object",
                  "properties": {
                    "point": {
                      "type": "number"
                    },
                    "low": {
                      "type": "array",
                      "items": {
                        "required": [],
                        "properties": {}
                      }
                    },
                    "high": {
                      "type": "array",
                      "items": {
                        "required": [],
                        "properties": {}
                      }
                    }
                  },
                  "required": [
                    "point",
                    "low",
                    "high"
                  ]
                },
                "peakWeek": {
                  "type": "object",
                  "properties": {
                    "point": {
                      "type": "number"
                    },
                    "low": {
                      "type": "array",
                      "items": {
                        "required": [],
                        "properties": {}
                      }
                    },
                    "high": {
                      "type": "array",
                      "items": {
                        "required": [],
                        "properties": {}
                      }
                    }
                  },
                  "required": [
                    "point",
                    "low",
                    "high"
                  ]
                },
                "peakPercent": {
                  "type": "object",
                  "properties": {
                    "point": {
                      "type": "number"
                    },
                    "low": {
                      "type": "array",
                      "items": {
                        "required": [],
                        "properties": {}
                      }
                    },
                    "high": {
                      "type": "array",
                      "items": {
                        "required": [],
                        "properties": {}
                      }
                    }
                  },
                  "required": [
                    "point",
                    "low",
                    "high"
                  ]
                },
                "oneWk": {
                  "type": "object",
                  "properties": {
                    "point": {
                      "type": "number"
                    },
                    "low": {
                      "type": "array",
                      "items": {
                        "required": [],
                        "properties": {}
                      }
                    },
                    "high": {
                      "type": "array",
                      "items": {
                        "required": [],
                        "properties": {}
                      }
                    }
                  },
                  "required": [
                    "point",
                    "low",
                    "high"
                  ]
                },
                "twoWk": {
                  "type": "object",
                  "properties": {
                    "point": {
                      "type": "number"
                    },
                    "low": {
                      "type": "array",
                      "items": {
                        "required": [],
                        "properties": {}
                      }
                    },
                    "high": {
                      "type": "array",
                      "items": {
                        "required": [],
                        "properties": {}
                      }
                    }
                  },
                  "required": [
                    "point",
                    "low",
                    "high"
                  ]
                },
                "threeWk": {
                  "type": "object",
                  "properties": {
                    "point": {
                      "type": "number"
                    },
                    "low": {
                      "type": "array",
                      "items": {
                        "required": [],
                        "properties": {}
                      }
                    },
                    "high": {
                      "type": "array",
                      "items": {
                        "required": [],
                        "properties": {}
                      }
                    }
                  },
                  "required": [
                    "point",
                    "low",
                    "high"
                  ]
                },
                "fourWk": {
                  "type": "object",
                  "properties": {
                    "point": {
                      "type": "number"
                    },
                    "low": {
                      "type": "array",
                      "items": {
                        "required": [],
                        "properties": {}
                      }
                    },
                    "high": {
                      "type": "array",
                      "items": {
                        "required": [],
                        "properties": {}
                      }
                    }
                  },
                  "required": [
                    "point",
                    "low",
                    "high"
                  ]
                },
                "week": {
                  "type": "number"
                }
              }
            }
          },
          "stats": {
            "type": "object",
            "properties": {
              "mae": {
                "type": "object",
                "properties": {
                  "oneWk": {
                    "type": "number"
                  },
                  "twoWk": {
                    "type": "number"
                  },
                  "threeWk": {
                    "type": "number"
                  },
                  "fourWk": {
                    "type": "number"
                  }
                },
                "required": [
                  "oneWk",
                  "twoWk",
                  "threeWk",
                  "fourWk"
                ]
              },
              "log": {
                "type": "object",
                "properties": {
                  "oneWk": {
                    "type": "number"
                  },
                  "twoWk": {
                    "type": "number"
                  },
                  "threeWk": {
                    "type": "number"
                  },
                  "fourWk": {
                    "type": "number"
                  }
                },
                "required": [
                  "oneWk",
                  "twoWk",
                  "threeWk",
                  "fourWk"
                ]
              }
            },
            "required": [
              "mae",
              "log"
            ]
          }
        }
      }
    },
    "history": {
      "type": "array",
      "uniqueItems": true,
      "minItems": 1,
      "items": {
        "required": [
          "id"
        ],
        "properties": {
          "id": {
            "type": "string",
            "minLength": 1
          },
          "actual": {
            "type": "array",
            "uniqueItems": true,
            "minItems": 1,
            "items": {
              "required": [
                "week",
                "data"
              ],
              "properties": {
                "week": {
                  "type": "number"
                },
                "data": {
                  "type": "number"
                }
              }
            }
          }
        }
      }
    }
  },
  "required": [
    "region",
    "observed",
    "actual",
    "baseline",
    "models",
    "history"
  ]
}
